관광지명,소재지도로명주소,관광지소개,데이터기준일자,제공기관명
문경 에코랄라(석탄박물관 포함),경상북도 문경시 가은읍 왕능길 112,백두대간 생태자원이라는 핵심 콘텐츠와 친환경 녹색문화의 중심 문경에서 영상문화 콘텐츠를 결합한 생태 녹색 에너지환경 테마의 휴양문화공간으로 조성되어 모든 연령층이 함께 즐길 수 있는 문화 콘텐츠 테마파크,2022-10-06,경상북도 문경시
문경 철로자전거(진남역),경상북도 문경시 마성면 진남1길 155,"전국 최초의 철로자전거, 영화의 촬영지로 쓰여도 좋을 만큼 예쁜 진남역을 출발해 진남교반의 절경을 감상하며 불정역까지 갔다가 돌아오는 코스",2022-10-06,경상북도 문경시
무지개다리,,"해상보도교량(L=300m, B=4m)",2022-10-24,전라남도 광양시
춤추는 바다분수,목포시 평화로 82,"목포춤추는바다분수는 매년 4월부터 11월까지 8개월간 목포 평화광장 앞바다에서 음악과 분수, 워터스크린, 레이저, 빔프로 젝트를 이용한 미디어 아트 작품을 선보이고 있다. 목포춤추는바다분수는 수반길이 150m, 높이 13.5m, 최대분사 높이 70m의 세계최초 초대형 부유식 바다음악분수이다.이에 더해 2021년 10월부터는 바다분수 앞에 설치한 해상무대에서 불꽃과 바다분수가 어우러진 환상적인 해상공연을 펼칠 예정이다.",2021-10-28,전라남도 목포시
목포해상케이블카,목포시 해양대학로 240,"155m의 높이에서 스릴넘치는 아찔한 체험을...국내 최장구간 3.23km의 해상케이블카로 북항에서 고하도까지 이어진다.목포항과 삼학도를 비롯한 목포 원도심이 한눈에 펼쳐지고 보석처럼 빛나는 다도해와목포대교, 고하도 등을 조망할 수 있다.",2021-10-28,전라남도 목포시
삼학도크루즈,목포시 삼학로 92번길 104,"삼학도 계류장을 출발하여 해상케이블카타워 ? 인어동상 ? 목포대교로 간다.잔잔한 목포 앞바다를 배를 타고 노니는것은 또 다른 경험이다. 오른쪽으로 높이오른 유달산과 목포대교의 일몰, 끝없이펼쳐진 다도해 그리고 고하도의 해안을감상할 수 있다.",2021-10-28,전라남도 목포시
김대중노벨평화상기념관,목포시 삼학로 92번길 68,"김대중 前대통령의 업적 및 걸어온 길을 살펴볼 수 있는 곳이다. 평화의 메시지 보내기, 노르웨이 오슬로 시상식장 체험, 노벨평화상 단상 포토존 및 대통령 집무실을 그대로 옮겨놓은 집무실 체험공간에서 대통령이 되어보는 체험을 할 수 있다",2021-10-28,전라남도 목포시
목포자연사박물관,목포시 남농로 135,"지구 46억년 자연사를 볼 수 있는 곳으로 다양한 생명체와 관람객이 공존하는 증강현실 사진관 체험,  박물관에 잠든 공룡알 화석을 부화시키는 게임형 AR 체험, 수생 생물이 살고 있는 연못 생태계 위를 거니는 콘텐츠등 다양한 VR, AR콘텐츠와 영상쇼를 제공한다",2021-10-28,전라남도 목포시
도림사,전라남도 곡성군 곡성읍 도림로 175,숲과 계곡이 아름다운 청정도량,2021-09-07,전라남도 곡성군
갓바위,목포시 남농로 135,"갓바위는 두 사람이 나란히 삿갓을 쓰고 서 있는 모습의 바위로 관광객들이 즐겨찾는 명소이며, 예전에는 배를 타고 나가야만 볼 수 있었던 갓바위를 해상에서 직접 조망할 수 있는 보행교를 바다위에 설치하였다.",2021-10-28,전라남도 목포시
인천가스과학관,인천광역시 연수구 인천신항대로960,"옥외조형물 5종, 실내전시물 23개코너, 크린타워",2021-10-25,인천광역시 연수구
인천상륙작전기념관,인천광역시 연수구 청량로160번길 26,"전시관, 야외전시장, 야외공연장, 영상실, 휴게실, 전망대, 소공원 등",2021-10-25,인천광역시 연수구
컴팩스마트시티,인천광역시 연수구 인천타워대로 238,"고대 및 근대 전시관, 인천 모형관, IFEZ모형관",2021-10-25,인천광역시 연수구
가천박물관,인천광역시 연수구 청량로102번길 40-9,"인천지역 유일한 국보를 포함한 총소장품 18,382점",2021-10-25,인천광역시 연수구
오월드,대전광역시 중구 사정공원로 70,Y,2021-10-27,대전광역시
뿌리공원,대전광역시 중구 뿌리공원로 79,Y,2021-10-27,대전광역시
엑스포과학공원,대전광역시 유성구 대덕대로 480,Y,2021-10-27,대전광역시
한밭수목원,대전광역시 서구 둔산대로 169,Y,2021-10-27,대전광역시
계족산황톳길,대전광역시 대덕구 장동로 59,Y,2021-10-27,대전광역시
대청호반,대전광역시 대덕구 대청로 607,Y,2021-10-27,대전광역시
장태산휴양림,대전광역시 서구 장안로 461,Y,2021-10-27,대전광역시
대전둘레산길,대전광역시 중구 보문산공원로 440,Y,2021-10-27,대전광역시
동춘당,대전광역시 대덕구 동춘당로 80,Y,2021-10-27,대전광역시
대전문화예술단지,대전광역시 서구 둔산대로 169,Y,2021-10-27,대전광역시
으능정이문화의거리,대전광역시 중구 중앙로 170,Y,2021-10-27,대전광역시
유성온천,대전광역시 유성구 계룡로60,Y,2021-10-27,대전광역시
금정산,부산광역시 금정구 범어사로 250,금정산은‘산마루에 우물이 있어 한 마리 금빛 나는 물고기가 오색구름을 타고 하늘에서 내려 와 우물 속에 놀았다’는 이야기에서 유래하여 이름 붙은 부산의 진산이다.,2021-10-21,부산광역시 금정구
범어사,부산광역시 금정구 범어사로 250,범어사는 역사적으로 많은 고승대덕을 길러내고 선승을 배출한 수행사찰로 오랜 전통과 많은 문화재가 보존되어 있는 한국 불교계의 중심지 중 하나이다.,2021-10-21,부산광역시 금정구
회동수원지,부산광역시 금정구 오륜대로258,"조선시대부터 아름다운 풍경으로 유명한 회동수원지는 금정구를 대표하는 도심 속 힐링 명소이다. 땅뫼산 황토숲길, 편백나무숲, 오륜대 전망대는 일상 속 휴식처가 되어 준다.",2021-10-21,부산광역시 금정구
서동미로시장,부산광역시 금정구 서동로141번길 16,서동미로시장은 아름다운 길(美路)이라는 의미이자 골목마다 형성된 상권이 미로같다 하여 이름 붙은 문화관광형 시장이다.,2021-10-21,부산광역시 금정구
스포원파크,부산광역시 금정구 체육공원로399번길 324,스포원파크는 기존의 경기장과는 달리 ‘공원’과 ‘개방’의 개념을 도입한 ‘공원형 경기장’으로서 쾌적한 환경여건을 가지고 있어 건강과 휴식을 위한 명소로 사랑받고 있다.,2021-10-21,부산광역시 금정구
한국이슬람부산성원,부산광역시 금정구 금단로 113-13,"부산의 유일한 한국이슬람 부산성원은 이슬람 신자들에게는 네트워킹 장이자 쉼터로, 지역민들에게는 이슬람 문화를 체험하고 강연을 접할 수 있는 장소로 자리 잡고 있다.",2021-10-21,부산광역시 금정구
요산문학관,부산광역시 금정구 팔송로 60-6,일제강점기의 잔인했던 시절 속 궁핍한 현실을 작품에 담은 요산 김정한 선생의 문학 정신과 삶을 기리는 문학관은 요산 선생의 생가와 연접해 그의 숨결을 더욱 깊이 느낄 수 있다.,2021-10-21,부산광역시 금정구
오륜대한국순교자박물관,부산광역시 금정구 오륜대로 106-1,한국 가톨릭 순교자들의 신념을 기억하기 위해 건립된 오륜대한국순교자박물관에는 한국 순교자들의 유물뿐만 아니라 역사적 의미가 있는 자료들도 함께 전시·보존하여 더욱 의미가 있다.,2021-10-21,부산광역시 금정구
부산대젊음의거리,부산광역시 금정구 장전온천천로 51,"청춘들의 꿈, 열정, 자유가 넘치는 부산대 젊음의 거리는 색다른 문화공연과 프리마켓 등 다양한 행사가 날마다 이어진다. 골목골목 위치한 상점에서 청춘의 열기를 느낄 수 있다.",2021-10-21,부산광역시 금정구
금정산성마을,부산광역시 금정구 산성로 452,금정산성마을은 금정산 해발 400m의 분지에 아담히 자리잡은 산성마을로 금정산 능선이 병풍처럼 둘러싸고 있는 아름다운 자연환경을 갖추고 있어 휴일이면 이곳을 찾는 등산객들의 발길이 끊이지 않는다.,2021-10-21,부산광역시 금정구
내원사계곡(내원사),경상남도 양산시 하북면 내원로 207,내원사 아래 울창한 숲 사이로 흐르는 이 계곡은 예로부터 소금강 또는 제2의 금강산으로 불릴만큼 자연경관이 빼어난 곳으로 계곡 곳곳에 독특한 바위가 특징이다.,2022-12-14,경상남도 양산시
대운산자연휴양림,경상남도 양산시 탑골길 270,대운산 서북쪽 자락에 위치하여 깊고 웅장하면서도 물이 맑아 고요한 숲의 분위기를 느끼며 자연에서의 특별한 하루를 보낼 수 있는 휴양처다.,2022-12-14,경상남도 양산시
반남고분군,전라남도 나주시 반남면 고분로 756,사적,2022-11-30,전라남도 나주시
백호문학관,전라남도 나주시 다시면 회진길 8,박물관,2022-11-30,전라남도 나주시
국립나주박물관,전라남도 나주시 반남면 고분로 747,박물관,2022-11-30,전라남도 나주시
예술의전당,서울특별시 서초구 남부순환로 2406,"수준높은 문화예술 콘텐츠와 편리한 시설, 감동적인 서비스가 조화를 이루는 우리나라 대표 복합문화공간이다. 예술가들의 열정이 고객 감동으로 이어지는 예술의 전당은 연간 300만명의 관람객이 찾는 문화놀이터이자 도심 속 문화 휴식공간이다.",2021-10-21,서울특별시 서초구
국립국악원,서울특별시 서초구 남부순환로 2364,"전통음악 및 무용의 계승과 발전을 위해 설립된 국립 음악기관으로 각종 국악 공연 및 연구, 진흥사업 등 다양한 활동을 펼치고 있다. 산하에 정악단, 무용단, 민속악단, 창작악단 등 네개의 전속 예술단과 예악당, 우면당, 풍류사랑방, 연희마당 등의 공연장, 국악박물관, 국악연수관 등의 시설을 갖추고 있다.",2021-10-21,서울특별시 서초구
서천무지개분수대,,음악분수 퍼포먼스 공연,2022-10-24,전라남도 광양시
장도전수관,전라남도 광양시 광양읍 매천로 771,"장도 선비·부녀자 사용, 중요무형문화재 60호 장도장",2022-10-24,전라남도 광양시
도립미술관,전라남도 광양시 순광로 680-4,2017년 말 착공 예정,2022-10-24,전라남도 광양시
광양와인동굴,전라남도 광양시 광양읍 강정길 33,"바닥 트릭아트, 세계 와인 전시, 와인 카페테리아, 오브젝트 맴핑, VR체험관 등",2022-10-24,전라남도 광양시
광양역사문화관,전라남도 광양시 광양읍 매천로 829,"광양의 역사, 문화, 인물 자료 전시·설명",2022-10-24,전라남도 광양시
사라실 라벤더 단지,,"라벤더마을, 라벤더 체험장",2022-10-24,전라남도 광양시
사라실 예술촌,전라남도 광양시 사곡로 201,광양 사라실 예술촌,2022-10-24,전라남도 광양시
광양 마로산성,,국가지정문화재 사적 제492호,2022-10-24,전라남도 광양시
광양 궁시장,,도지정무형문화재 제12호,2022-10-24,전라남도 광양시
매천황현생가,전라남도 광양시 봉강면 서석길 14-3,조선의 마지막 선비 우국지사 매천 황현선생 생가,2022-10-24,전라남도 광양시
해달별천문대,전라남도 광양시 봉강면 하조길 91-20,"낮-태양, 밤-해·달 관찰, 천체사진 촬영",2022-10-24,전라남도 광양시
백운산자연휴양림,전라남도 광양시 옥룡면 백계로 33,"교육장, 야영장, 수영장, 산책로",2022-10-24,전라남도 광양시
광양 옥룡사지,전라남도 광양시 옥룡면 추산리 산 35-1,국가지정문화재 사적 제207호,2022-10-24,전라남도 광양시
국사봉랜드,전라남도 광양시 옥곡면 대치로 433,"숙박, 물놀이장, 야외공연장",2022-10-24,전라남도 광양시
기독교선교100주년기념관,전라남도 광양시 진상면 성지로 399,"기독교역사관, 유품전시관",2022-10-24,전라남도 광양시
섬진강 망덕포구,전라남도 광양시 진월면 망덕길 171,"550리 섬진강과 남해바다가 만나는곳, 윤동주시인 유고보존 정병욱 가옥",2022-10-24,전라남도 광양시
윤동주 유고 보존 정병욱 가옥,전라남도 광양시 진월면 망덕길 249,국가등록문화재 제341호,2022-10-24,전라남도 광양시
광양매화문화관,전라남도 광양시 다압면 지막1길 21,"매화꽃, 매실가공식품, 홍쌍리 명인",2022-10-24,전라남도 광양시
느랭이골자연리조트,전라남도 광양시 토끼재길 119-32,"편백숲 삼림욕장, 글램핑장, 별빛축제",2022-10-24,전라남도 광양시
구봉산전망대,전라남도 광양시 구봉산전망대길 155,"해발 473m 구봉산, 9.4m 봉수대, 광양만야경",2022-10-24,전라남도 광양시
광양항해양공원,,"공연장, 포토존, 산책로",2022-10-24,전라남도 광양시
헌인릉,서울특별시 서초구 헌인릉길 36-10,"사적 제 194호인 이곳은 동쪽의 헌릉과 서쪽의 인릉으로 구성되어 있다. 헌릉은 조선 제3대 태종과 원경왕후 민씨의 쌍봉릉이며, 인릉은 조선 제23대 순조와 순원왕후 김씨의 동원합동 형태이다.",2021-10-21,서울특별시 서초구
매헌 윤봉길의사 기념관,서울특별시 서초구 매헌로 99,"윤봉길의사의 업적과 살신성인 정신의 높은 뜻을 선양하고 계승 발전시키키 위하여 1988년 준공되었다. 기념관 1층에는 유품과 생애사진이 전시되어 있으며, 2층에는 사무처, 매헌연구원, 세미나실, 윤봉길 도서관 등을 갖추고 있다.",2021-10-21,서울특별시 서초구
고투몰,서울특별시 서초구 신반포로200,"고속터미널 지하상가를 일컫는 고투몰은 카페, 음식점, 꽃시장 등 다양한 먹거리와 볼거리를 선사하는 곳이다. 의류, 신발, 각종 액세서리 등을 싸게 구입할 수 있으며, 계절에 맞는 만개한 꽃들을 구경할 수 있다.",2021-10-21,서울특별시 서초구
"세빛섬, 반포대교 달빛무지개분수",서울특별시 서초구 올림픽대로683,"세빛섬은 세 개의 빛나는 섬이라는 의미로, 세계 최초로 물 위에 떠 있는 부체 위에 건물을 짓는 플로팅 형태의 건축물이다. 가빛섬, 채빛섬, 솔빛섬 등 3개의 섬이 다리로 연결되어 있고 미디어아트갤러리 예빛섬이 함께 조화를 이루고 있으며 컨벤션홀, 공연, 전시, 레스토랑 시설 등을 갖춘 복합문화공간이다.",2021-10-21,서울특별시 서초구
삼성딜라이트,서울특별시 서초구 서초대로74길 11,"삼성딜라이트는 테마별로 꾸며진 최신 디지털 기술을 통해 미래의 새로운 생활패턴을 체험할 수 있다. 지상 1층과 2층은 삼성전자의 홍보관으로 관람객이 직접 흥미로운 디지털 미디어 인터렉션을 자유롭게 체험할 수 있으며, 지하 2층은 국내 최대 모바일 샵으로 다양한 삼성 전자제품의 체험과 구매가 가능하다.",2021-10-21,서울특별시 서초구
천지연폭포,제주특별자치도 서귀포시 남성중로 2-15(서홍동),하늘과 땅이 만나는 곳의 연못이라는 뜻의 천지연은 난대식물지대로서 계곡전체가 천연보호구역으로 지정되어 있어 주변 경관이 수려함. 조명시설이 되어있어 오후 10시까지 야간 관람 가능함.(천연기념물 제163호 담팔수 자생지. 제379호 천지연 난대림. 제27호 무태장어 서식지),2021-10-22,제주특별자치도 서귀포시
정방폭포,제주특별자치도 서귀포시 칠십리로214번길 37(동홍동),높이 23m. 너비 8m. 깊이 5m에 달하는 동양 유일의 해안폭포로서 폭포수가 바다로 직접 떨어지는 경관을 관람할 수 있음(명승 제43호),2021-10-22,제주특별자치도 서귀포시
중문대포주상절리대,제주특별자치도 서귀포시 이어도로 36-30(중문동),주상절리는 주로 현무암질 용암류에 형성되는 수직절리를 말함. 중문·대포해안 주상절리대는 높이가 30~40m. 폭이 약 1km 정도로 우리나라 최대 규모로 육모꼴의 기둥이 병풍처럼 둘러쳐져 있어 자연의 신비를 만끽할 수 있음.(천연기념물 제 443호. 제주도지질공원),2021-10-22,제주특별자치도 서귀포시
천제연폭포,제주특별자치도 서귀포시 천제연로 132(중문동),한라산에서 시작된 중문천이 바다로 흐르면서 형성된 폭포. 3개의 폭포로 나뉘어 지는데 주상절리 절벽에서 천제연(못)으로 떨어지는 1폭포. 천제연 물이 더 아래로 흐르면서 형성된 2. 3폭포가 있음. 옥황상제를 모시는 칠선녀가 목욕을 하다 간다는 전설이 있을만큼 빼어난 경관을 자랑함(천연기념물 제378호 천제연 난대림),2021-10-22,제주특별자치도 서귀포시
산방산,제주특별자치도 서귀포시 안덕면 산방로 218-11,높이 395m의 거대한 종 모양의 화산체로서 설문대할망이 한라산 꼭대기를 뽑아 던져 놓았다는 전설이 있음. 해발고도 200m에 산방굴이라는 해식동굴이 있음. (명승 제77호. 천연기념물 제376호. 제주도지질공원),2021-10-22,제주특별자치도 서귀포시
용머리해안,,마치 바다속으로 들어가는 용의 머리를 닮았다 해서 용머리해안으로 불림. 수천만년 동안 층층이 쌓인 사암층 암벽이 파도에 깎여 기묘한 절벽을 이루고 있음. (천연기념물 제526호. 제주도지질공원),2021-10-22,제주특별자치도 서귀포시
감귤박물관,제주특별자치도 서귀포시 효돈순환로 441(신효동),제주감귤의 역사와 문화. 산업현장을 의미있는 관점에서 전시한 박물관으로. 감귤 관련 전시물과 다양한 감귤 품종 및 이국의 식물을 관람할 수 있음. 또한 감귤과 관련한 다양한 체험 프로그램도 준비되어 있으며. 최근 개장한 감귤카페 꿈나다에서 주변 경치를 구경하며 맛있는 감귤 음료. 디저트를 저렴한 가격에 즐길 수 있음.,2021-10-22,제주특별자치도 서귀포시
용담호및주변시설,전라북도 진안군 안천면 안용로 793,"댐으로 만들어진 인공호수로써 높이 70m, 길이 498m, 저수량이 8억1,500톤에 이르고 댐주위로 난 이설도로를 따라 여러가지 볼거리가 구비되어 있다.",2022-11-29,전라북도 진안군
운장산자연휴양림,전라북도 진안군 정천면 휴향림길 77,약7㎞에 달하는 운장산 계곡은 원시림과 옥류수가 연중 흐르고 순환임도와 연접하고 여러가지 기암바위들이 자연수목과 조화를 이룬다,2022-11-29,전라북도 진안군
간월도관광지,,개발진행중,2022-08-25,충청남도 서산시
데미샘자연휴양림,전라북도 진안군 백운면 데미샘1길 172,데미샘은 3개도 10개 시군에 걸쳐 218.6㎞를 흐르는 우리나라에서 4번째로 긴강인 섬진강의 발원지이다,2022-11-29,전라북도 진안군
진안고원치유의숲,전라북도 진안군 정천면 봉학로 171-22,"전국 최초로 설립된 환경성질환 예방교육시설이다. 생활치료 공간으로 교육관과 생활관, 체험관, 유기농식당을 갖추고 있다. 방학과 주말은 물론 평일에도 아토피로 고통받는 어린이와 가족들이 함께행활하면저 치유할수 있다",2022-11-29,전라북도 진안군
가위박물관,전라북도 진안군 진안읍 마이산로 258,"세계유일의 가위박물관, 진안가위박물관, 마이산북부에 위치하고 세계 희귀 가위 1,500여점을 소장",2022-11-29,전라북도 진안군
구)나주역,전라남도 나주시 죽림길 26,전라남도기념물,2022-11-30,전라남도 나주시
노안천주교회,전라남도 나주시 노안면 이슬촌길 108,등록문화재,2022-11-30,전라남도 나주시
나주시천연염색박물관,전라남도 나주시 다시면 백호로 379,박물관,2022-11-30,전라남도 나주시
나주목문화관,전라남도 나주시 금성관길 15,박물관,2022-11-30,전라남도 나주시
중흥골드스파&리조트,전라남도 나주시 다도면 나주호로 558-314,유원지,2022-11-30,전라남도 나주시
나주영상테마파크,전라남도 나주시 공산면 덕음로 450,테마공원,2022-11-30,전라남도 나주시
남파고택,전라남도 나주시 금성길 13,중요민속자료,2022-11-30,전라남도 나주시
아담원,전라북도 남원시 이백면 목가길 193,"아담원은 본래 나무를 키우던 조경농원이었던 곳으로 지난 10년간 정성으로 가꾸어 아름다운 정원으로 재탄생 하였습니다. 나무 한 주, 풀 한포기까지 엄선하여 심고, 관리하여 지리산자락의 비경과 함께 훌륭한 힐링의 장을 제공해 줄 것입니다. 아무쪼록 방문하시어 편안한 휴식을 만끽하시길 바랍니다",2022-11-23,전라북도 남원시
남원관광지,전라북도 남원시 양림길 12,"남원하면 떠오르는 모든 상징물과 위락시설들을 모아 놓은 종합관광단지이다. 남원시 어현동 일대에 자리하고 있다. 한국관광공사가 조성한 남원관광단지에는 춘향전과 관련된 춘향테마파크, 춘향문화예술회관을 비롯해 국립민속국악원, 남원향토박물관 등의 문화시설이 있다.",2022-11-23,전라북도 남원시
함평해수찜,전라남도 함평군 손불면 석산로 61,온천과 약찜의 효능을 한꺼번에 즐길수 있음,2022-11-09,전라남도 함평군
함평자연생태공원,전라남도 함평군 대동면 학동로 1398-77,사계절 탐방학습과 생태체험,2022-11-09,전라남도 함평군
함평양서파충류생태공원,전라남도 함평군 신광면 학동로 1398-9,국내 최대 양서파충류 전문 전시관,2022-11-09,전라남도 함평군
방화동가족휴가촌,전라북도 장수군 번암면 방화동로 778,전국 8대종산에 속하는 장안산 기슭을 따라 펼쳐지는 맑고 깨끗한 계곡을 끼고 조성된 국민 휴양지,2021-10-12,전라북도 장수군
경천대관광지,경상북도 상주시 사벌국면 경천로 652,낙동강 1300여 리 물길 중 강의 이름이 되었을 정도로 태고의 신비를 간직한 경천대는 깎아지른 절벽과 노송으로 이루어진 절경이 빼어난 곳으로 하늘이 스스로 내렸다고 해 자천대라고도 함,2022-12-08,경상북도 상주시
회상나루관광지,경상북도 상주시 중동면 갱다불길 97,"낙동강 회상나루의 새로운 해석과 재현을 통해 주막 · 역원 등을 소재로 전통한옥으로 지은 주막촌, 객주촌, 낙동강 문학관 등이 조성되어 관광객들에게 편의를 제공함",2022-12-08,경상북도 상주시
대가야생활촌,경상북도 고령군 대가야읍 신남로 81,"역사적 고증과 현대적 상상을 바탕으로 대가야의 역사와 문화의 과거, 현재, 미래의 모습을 볼 수 있도록 재현한 대가야생활촌입니다. 대가야생활촌에는 1500년 전 대가야시대로 안내해주는 인트로영상관, 대가야 의식주 생활상을 재현한 인줄마을, 대가야를 대표하는 철기문화를 직접 체험할 수 있는 불묏골, 대가야의 토기문화와 교역물품을 알아볼 수 있는 골안마을, 아름다운 경관을 감상 할 수 있는 상가라도못, 짚라인을 즐길 수 있는 놀이터가 있는 메나릿골, 여름철 시원한 물놀이가 가능한 물놀이장, 대가야 철의 원정대 일원이 되어 원정선 하지호에 승선할 수 있는 주산성전시관, 기와마을과 초가마을로 이루어진 숙박시설 한기촌 등이 있어 학습체험과 관광숙박을 한 곳에서 즐길 수 있습니다.",2022-11-28,경상북도 고령군
공주문화관광지,,백제역사 유적관광지,2022-11-23,충청남도 공주시
대가야역사테마관광지,경상북도 고령군 대가야읍 대가야로 1216,"찬란하게 꽃 피웠던 대가야의 토기와 철기, 가야금 문화 등 대가야의 역사를 테마로 하여 조성된 관광지입니다. 대가야에 대하여 배워볼 수 있는 전시관들 및 대가야탐방숲길이 있으며, 아이들이 즐겁게 즐길 수 있는 레일썰매장, 물놀이장을 운영하고 있습니다.",2022-11-28,경상북도 고령군
부례관광지,경상북도 고령군 우곡면 우곡강변길 672,"낙동강을 중심으로 한 녹색성장시대의 새로운 강변문화 관광지입니다. 풋살장과 농구장 같은 스포츠공간과 카라반 시설과 바이크텔이 있어,  건강하고 재밌는 체험과 숙박을 함께 즐길 수 있습니다.",2022-11-28,경상북도 고령군
고양관광정보센터,경기도 고양시 일산동구 중앙로1271-1,고양시 관광지 자료 배포 및 시티투어 안내,2022-11-22,경기도 고양시
운일암반일암,전라북도 진안군 주천면 동상주천로 1924,"기암괴석과 크고 작은 폭포, 소가 어울려 빚어낸 절경",2022-11-29,전라북도 진안군
